data/processed/runs/v23/2026-02-24_06-19-21_hyperparam_sweep/run_r60_b64_e1_lr3e-4_a0.5/analysis/compression_analysis.csv

stage,model_path,file_size_bytes,file_size_mb,parameter_count,accuracy,precision,recall,f1_score,precision_normal,recall_normal,avg_latency_ms,min_latency_ms,max_latency_ms,samples_per_second,compression_ratio
Baseline,models/tflite/saved_model_original.tflite,817528,0.7796554565429688,204880,0.1775281515062884,0.1775286923829226,0.9999828385103827,0.30152680643633906,0.0,0.0,1.9551992416381836,1.9214153289794922,2.0241737365722656,51145.6826856244,1.0
Traditional+PTQ,models/tflite/saved_model_no_qat_ptq.tflite,70856,0.06757354736328125,61969,0.2203982645997855,0.18548227939163595,1.0,0.31292290507593495,1.0,0.05211999081324967,0.4756927490234375,0.4677772521972656,0.5371570587158203,210219.7273456295,11.537879643220052
Traditional+QAT,models/tflite/saved_model_traditional_qat.tflite,66600,0.06351470947265625,62048,0.9641464365798966,0.8737261709583052,0.9328642526171271,0.9023272799707845,0.9852937859478967,0.9708987457122324,0.47905445098876953,0.47206878662109375,0.5218982696533203,208744.5378987707,12.275195195195195
QAT+PTQ,models/tflite/saved_model_qat_ptq.tflite,68624,0.0654449462890625,61520,0.17753119820610314,0.17753119820610314,1.0,0.3015312010018267,0.0,0.0,0.47593116760253906,0.46706199645996094,0.5311965942382812,210114.41739304678,11.913149918395897
QAT+QAT,models/tflite/saved_model_pruned_qat.tflite,66600,0.06351470947265625,62048,0.9598932436384908,0.8713528288217085,0.9081688690578342,0.8893800104199929,0.9799956634217099,0.9710580321091742,0.48024654388427734,0.4734992980957031,0.5238056182861328,208226.38137318174,12.275195195195195

data/processed/runs/v23/2026-02-24_06-19-21_hyperparam_sweep/run_r60_b64_e1_lr5e-4_a0.8/analysis/compression_analysis.md

### Baseline

- **Model Path**: `models/tflite/saved_model_original.tflite`
- **File Size**: 0.7797 MB (817,528 bytes)
- **Parameters**: 204,880
- **Accuracy**: 0.1776
- **Precision**: 0.1775
- **Recall**: 1.0000
- **F1-Score**: 0.3015
- **Normal Recall** (of actual normal, % predicted as normal): 0.0001
- **Normal Precision** (of predicted normal, % actually normal): 0.9583
- **Avg Latency**: 1.87 ms
- **Samples/sec**: 53570.52
- **Compression Ratio**: 1.00x

### Traditional+PTQ

- **Model Path**: `models/tflite/saved_model_no_qat_ptq.tflite`
- **File Size**: 0.0676 MB (70,856 bytes)
- **Parameters**: 61,969
- **Accuracy**: 0.2204
- **Precision**: 0.1855
- **Recall**: 1.0000
- **F1-Score**: 0.3129
- **Normal Recall** (of actual normal, % predicted as normal): 0.0521
- **Normal Precision** (of predicted normal, % actually normal): 1.0000
- **Avg Latency**: 0.47 ms
- **Samples/sec**: 212423.60
- **Compression Ratio**: 11.54x

### Traditional+QAT

- **Model Path**: `models/tflite/saved_model_traditional_qat.tflite`
- **File Size**: 0.0635 MB (66,600 bytes)
- **Parameters**: 62,048
- **Accuracy**: 0.9649
- **Precision**: 0.8769
- **Recall**: 0.9330
- **F1-Score**: 0.9041
- **Normal Recall** (of actual normal, % predicted as normal): 0.9717
- **Normal Precision** (of predicted normal, % actually normal): 0.9853
- **Avg Latency**: 0.48 ms
- **Samples/sec**: 209484.77
- **Compression Ratio**: 12.28x

### QAT+PTQ

- **Model Path**: `models/tflite/saved_model_qat_ptq.tflite`
- **File Size**: 0.0654 MB (68,624 bytes)
- **Parameters**: 61,520
- **Accuracy**: 0.1775
- **Precision**: 0.1775
- **Recall**: 1.0000
- **F1-Score**: 0.3015
- **Normal Recall** (of actual normal, % predicted as normal): 0.0000
- **Normal Precision** (of predicted normal, % actually normal): 0.0000
- **Avg Latency**: 0.47 ms
- **Samples/sec**: 212230.13
- **Compression Ratio**: 11.91x