data/processed/runs/v20/2026-02-12_02-47-37_hyperparam_sweep/run_r60_b64_e2_lr5e-4_a0.65/analysis/compression_analysis.csv

stage,model_path,file_size_bytes,file_size_mb,parameter_count,accuracy,precision,recall,f1_score,precision_normal,recall_normal,avg_latency_ms,min_latency_ms,max_latency_ms,samples_per_second,compression_ratio
Original,models/tflite/saved_model_original.tflite,821652,0.7835884094238281,205777,0.4773660670761431,0.21464955637177105,0.73113094216578,0.3318675583356378,0.8792496165614619,0.42259051542114584,2.227663993835449,2.1054744720458984,2.6671886444091797,44890.07331299834,1.0
QAT+Prune only,models/tflite/saved_model_qat_pruned_float32.tflite,248212,0.23671340942382812,61969,0.7202154626108999,0.38816394535154947,0.9995538012699502,0.5591781874039938,0.9998540752298315,0.6599198381946554,0.8379697799682617,0.8132457733154297,0.9059906005859375,119336.04575070419,3.3102831450534222
Compressed (PTQ),models/tflite/saved_model_pruned_quantized.tflite,70920,0.06763458251953125,61969,0.7203281905040461,0.38825968416070605,0.9995538012699502,0.5592775214491821,0.9998541055265949,0.6600568985827215,0.5514860153198242,0.5395412445068359,0.6256103515625,181328.26077558254,11.585617597292725
QAT+PTQ,models/tflite/saved_model_qat_ptq.tflite,70904,0.06761932373046875,61969,0.7203281905040461,0.38825968416070605,0.9995538012699502,0.5592775214491821,0.9998541055265949,0.6600568985827215,0.5450010299682617,0.5359649658203125,0.6015300750732422,183485.8917712936,11.58823197562902
noQAT+PTQ,models/tflite/saved_model_no_qat_ptq.tflite,70920,0.06763458251953125,61969,0.8224688017938968,0.0,0.0,0.0,0.8224688017938968,1.0,0.5459070205688477,0.5352497100830078,0.6060600280761719,183181.3774730314,11.585617597292725

data/processed/runs/v20/2026-02-12_02-47-37_hyperparam_sweep/run_r60_b64_e2_lr5e-4_a0.65/analysis/compression_analysis.md

### Original

- **Model Path**: `models/tflite/saved_model_original.tflite`
- **File Size**: 0.7836 MB (821,652 bytes)
- **Parameters**: 205,777
- **Accuracy**: 0.4774
- **Precision**: 0.2146
- **Recall**: 0.7311
- **F1-Score**: 0.3319
- **Normal Recall** (of actual normal, % predicted as normal): 0.4226
- **Normal Precision** (of predicted normal, % actually normal): 0.8792
- **Avg Latency**: 2.23 ms
- **Samples/sec**: 44890.07
- **Compression Ratio**: 1.00x

### QAT+Prune only

- **Model Path**: `models/tflite/saved_model_qat_pruned_float32.tflite`
- **File Size**: 0.2367 MB (248,212 bytes)
- **Parameters**: 61,969
- **Accuracy**: 0.7202
- **Precision**: 0.3882
- **Recall**: 0.9996
- **F1-Score**: 0.5592
- **Normal Recall** (of actual normal, % predicted as normal): 0.6599
- **Normal Precision** (of predicted normal, % actually normal): 0.9999
- **Avg Latency**: 0.84 ms
- **Samples/sec**: 119336.05
- **Compression Ratio**: 3.31x

### Compressed (PTQ)

- **Model Path**: `models/tflite/saved_model_pruned_quantized.tflite`
- **File Size**: 0.0676 MB (70,920 bytes)
- **Parameters**: 61,969
- **Accuracy**: 0.7203
- **Precision**: 0.3883
- **Recall**: 0.9996
- **F1-Score**: 0.5593
- **Normal Recall** (of actual normal, % predicted as normal): 0.6601
- **Normal Precision** (of predicted normal, % actually normal): 0.9999
- **Avg Latency**: 0.55 ms
- **Samples/sec**: 181328.26
- **Compression Ratio**: 11.59x

### QAT+PTQ

- **Model Path**: `models/tflite/saved_model_qat_ptq.tflite`
- **File Size**: 0.0676 MB (70,904 bytes)
- **Parameters**: 61,969
- **Accuracy**: 0.7203
- **Precision**: 0.3883
- **Recall**: 0.9996
- **F1-Score**: 0.5593
- **Normal Recall** (of actual normal, % predicted as normal): 0.6601
- **Normal Precision** (of predicted normal, % actually normal): 0.9999
- **Avg Latency**: 0.55 ms
- **Samples/sec**: 183485.89
- **Compression Ratio**: 11.59x

### noQAT+PTQ

- **Model Path**: `models/tflite/saved_model_no_qat_ptq.tflite`
- **File Size**: 0.0676 MB (70,920 bytes)
- **Parameters**: 61,969
- **Accuracy**: 0.8225
- **Precision**: 0.0000
- **Recall**: 0.0000
- **F1-Score**: 0.0000
- **Normal Recall** (of actual normal, % predicted as normal): 1.0000
- **Normal Precision** (of predicted normal, % actually normal): 0.8225
- **Avg Latency**: 0.55 ms
- **Samples/sec**: 183181.38
- **Compression Ratio**: 11.59x