data/processed/runs/v20/2026-02-13_04-29-29_hyperparam_sweep/run_r100_b64_e2_lr1e-3_a0.8/analysis/compression_analysis.csv

stage,model_path,file_size_bytes,file_size_mb,parameter_count,accuracy,precision,recall,f1_score,precision_normal,recall_normal,avg_latency_ms,min_latency_ms,max_latency_ms,samples_per_second,compression_ratio
Original,models/tflite/saved_model_original.tflite,821632,0.7835693359375,205777,0.5962117334503266,0.293444218841265,0.905285738802128,0.4432205347953032,0.9628247529620972,0.5294976181127155,1.9001960754394531,1.8720626831054688,1.9996166229248047,52626.14805520703,1.0
QAT+Prune only,models/tflite/saved_model_qat_pruned_float32.tflite,248228,0.23672866821289062,61969,0.7898447401774398,0.45784849391424837,0.9980264286940106,0.6277254868097233,0.9994284464677992,0.7449083918000845,0.7633447647094727,0.7522106170654297,0.8034706115722656,131002.40497235845,3.3099892034742253
Compressed (PTQ),models/tflite/saved_model_pruned_quantized.tflite,70920,0.06763458251953125,61969,0.7880837476845082,0.4557814067201605,0.9981980435901836,0.6258136707444347,0.9994765911628649,0.742730242930277,0.4782676696777344,0.4696846008300781,0.5228519439697266,209087.93619142572,11.585335589396504
QAT+PTQ,models/tflite/saved_model_qat_ptq.tflite,70904,0.06761932373046875,61969,0.7880837476845082,0.4557814067201605,0.9981980435901836,0.6258136707444347,0.9994765911628649,0.742730242930277,0.48029422760009766,0.4730224609375,0.5276203155517578,208205.70861255893,11.587949904095678
noQAT+PTQ,models/tflite/saved_model_no_qat_ptq.tflite,70920,0.06763458251953125,61969,0.8224688017938968,0.0,0.0,0.0,0.8224688017938968,1.0,0.470733642578125,0.46324729919433594,0.5123615264892578,212434.35980551052,11.585335589396504

data/processed/runs/v20/2026-02-12_02-47-37_hyperparam_sweep/run_r60_b64_e1_lr1e-3_a0.8/analysis/compression_analysis.md

### Original

- **Model Path**: `models/tflite/saved_model_original.tflite`
- **File Size**: 0.7836 MB (821,652 bytes)
- **Parameters**: 205,777
- **Accuracy**: 0.9139
- **Precision**: 0.6751
- **Recall**: 0.9923
- **F1-Score**: 0.8035
- **Normal Recall** (of actual normal, % predicted as normal): 0.8969
- **Normal Precision** (of predicted normal, % actually normal): 0.9982
- **Avg Latency**: 2.16 ms
- **Samples/sec**: 46234.53
- **Compression Ratio**: 1.00x

### QAT+Prune only

- **Model Path**: `models/tflite/saved_model_qat_pruned_float32.tflite`
- **File Size**: 0.2367 MB (248,212 bytes)
- **Parameters**: 61,969
- **Accuracy**: 0.8141
- **Precision**: 0.4884
- **Recall**: 0.9981
- **F1-Score**: 0.6559
- **Normal Recall** (of actual normal, % predicted as normal): 0.7743
- **Normal Precision** (of predicted normal, % actually normal): 0.9995
- **Avg Latency**: 0.85 ms
- **Samples/sec**: 117487.51
- **Compression Ratio**: 3.31x

### Compressed (PTQ)

- **Model Path**: `models/tflite/saved_model_pruned_quantized.tflite`
- **File Size**: 0.0676 MB (70,920 bytes)
- **Parameters**: 61,969
- **Accuracy**: 0.8144
- **Precision**: 0.4888
- **Recall**: 0.9981
- **F1-Score**: 0.6562
- **Normal Recall** (of actual normal, % predicted as normal): 0.7747
- **Normal Precision** (of predicted normal, % actually normal): 0.9995
- **Avg Latency**: 0.55 ms
- **Samples/sec**: 183413.68
- **Compression Ratio**: 11.59x

### QAT+PTQ

- **Model Path**: `models/tflite/saved_model_qat_ptq.tflite`
- **File Size**: 0.0676 MB (70,904 bytes)
- **Parameters**: 61,969
- **Accuracy**: 0.8144
- **Precision**: 0.4888
- **Recall**: 0.9981
- **F1-Score**: 0.6562
- **Normal Recall** (of actual normal, % predicted as normal): 0.7747
- **Normal Precision** (of predicted normal, % actually normal): 0.9995
- **Avg Latency**: 0.55 ms
- **Samples/sec**: 181163.79
- **Compression Ratio**: 11.59x

### noQAT+PTQ

- **Model Path**: `models/tflite/saved_model_no_qat_ptq.tflite`
- **File Size**: 0.0676 MB (70,920 bytes)
- **Parameters**: 61,969
- **Accuracy**: 0.8225
- **Precision**: 0.0000
- **Recall**: 0.0000
- **F1-Score**: 0.0000
- **Normal Recall** (of actual normal, % predicted as normal): 1.0000
- **Normal Precision** (of predicted normal, % actually normal): 0.8225
- **Avg Latency**: 0.55 ms
- **Samples/sec**: 182726.50
- **Compression Ratio**: 11.59x